{
  "spiceVersion": 1,
  "id": "mirage-landscape",
  "version": "1.0.0",
  "name": "Mirage Landscape",
  "description": "Tunables for the landscape lighting and softened shadow edges; an experimental GLSL replacement in extras\\.",
  "melange": { "range": ">=0.2.0 <0.5.0" },
  "kind": "client-only",
  "entry": {},
  "defaultEnabled": false
}
