{
  "spiceVersion": 1,
  "id": "mirage-samples",
  "version": "1.0.0",
  "name": "Mirage Samples",
  "description": "Five sample post-processing effects (SMAA, CAS sharpen, SSAO, bloom, tonemap); all off by default in the Mirage/Post-FX panel.",
  "melange": { "range": ">=0.2.0 <0.5.0" },
  "kind": "client-only",
  "defaultEnabled": false,
  "entry": {}
}
